,code,term
0,C00X,Malignant neoplasm of lip
1,C00-C14,"Malignant neoplasms of lip, oral cavity and pharynx"
2,C00-C75,"Malignant neoplasms, stated or presumed to be primary, of specified sites, except of lymphoid, haematopoietic and related tissue"
3,C00-C97,Malignant neoplasms
4,C000,Malignant neoplasm: External upper lip
5,C001,Malignant neoplasm: External lower lip
6,C002,"Malignant neoplasm: External lip, unspecified"
7,C003,"Malignant neoplasm: Upper lip, inner aspect"
8,C004,"Malignant neoplasm: Lower lip, inner aspect"
9,C005,"Malignant neoplasm: Lip, unspecified, inner aspect"
10,C006,Malignant neoplasm: Commissure of lip
11,C008,Malignant neoplasm: Overlapping lesion of lip
12,C009,"Malignant neoplasm: Lip, unspecified"
13,C01X,Malignant neoplasm of base of tongue
14,C02X,Malignant neoplasm of other and unspecified parts of tongue
15,C020,Malignant neoplasm: Dorsal surface of tongue
16,C021,Malignant neoplasm: Border of tongue
17,C022,Malignant neoplasm: Ventral surface of tongue
18,C023,"Malignant neoplasm: Anterior two-thirds of tongue, part unspecified"
19,C024,Malignant neoplasm: Lingual tonsil
20,C028,Malignant neoplasm: Overlapping lesion of tongue
21,C029,"Malignant neoplasm: Tongue, unspecified"
22,C03X,Malignant neoplasm of gum
23,C030,Malignant neoplasm: Upper gum
24,C031,Malignant neoplasm: Lower gum
25,C039,"Malignant neoplasm: Gum, unspecified"
26,C04X,Malignant neoplasm of floor of mouth
27,C040,Malignant neoplasm: Anterior floor of mouth
28,C041,Malignant neoplasm: Lateral floor of mouth
29,C048,Malignant neoplasm: Overlapping lesion of floor of mouth
30,C049,"Malignant neoplasm: Floor of mouth, unspecified"
31,C05X,Malignant neoplasm of palate
32,C050,Malignant neoplasm: Hard palate
33,C051,Malignant neoplasm: Soft palate
34,C052,Malignant neoplasm: Uvula
35,C058,Malignant neoplasm: Overlapping lesion of palate
36,C059,"Malignant neoplasm: Palate, unspecified"
37,C06X,Malignant neoplasm of other and unspecified parts of mouth
38,C060,Malignant neoplasm: Cheek mucosa
39,C061,Malignant neoplasm: Vestibule of mouth
40,C062,Malignant neoplasm: Retromolar area
41,C068,Malignant neoplasm: Overlapping lesion of other and unspecified parts of mouth
42,C069,"Malignant neoplasm: Mouth, unspecified"
43,C07X,Malignant neoplasm of parotid gland
44,C08X,Malignant neoplasm of other and unspecified major salivary glands
45,C080,Malignant neoplasm: Submandibular gland
46,C081,Malignant neoplasm: Sublingual gland
47,C088,Malignant neoplasm: Overlapping lesion of major salivary glands
48,C089,"Malignant neoplasm: Major salivary gland, unspecified"
49,C09X,Malignant neoplasm of tonsil
50,C090,Malignant neoplasm: Tonsillar fossa
51,C091,Malignant neoplasm: Tonsillar pillar (anterior)(posterior)
52,C098,Malignant neoplasm: Overlapping lesion of tonsil
53,C099,"Malignant neoplasm: Tonsil, unspecified"
54,C10X,Malignant neoplasm of oropharynx
55,C100,Malignant neoplasm: Vallecula
56,C101,Malignant neoplasm: Anterior surface of epiglottis
57,C102,Malignant neoplasm: Lateral wall of oropharynx
58,C103,Malignant neoplasm: Posterior wall of oropharynx
59,C104,Malignant neoplasm: Branchial cleft
60,C108,Malignant neoplasm: Overlapping lesion of oropharynx
61,C109,"Malignant neoplasm: Oropharynx, unspecified"
62,C11X,Malignant neoplasm of nasopharynx
63,C110,Malignant neoplasm: Superior wall of nasopharynx
64,C111,Malignant neoplasm: Posterior wall of nasopharynx
65,C112,Malignant neoplasm: Lateral wall of nasopharynx
66,C113,Malignant neoplasm: Anterior wall of nasopharynx
67,C118,Malignant neoplasm: Overlapping lesion of nasopharynx
68,C119,"Malignant neoplasm: Nasopharynx, unspecified"
69,C12X,Malignant neoplasm of piriform sinus
70,C13X,Malignant neoplasm of hypopharynx
71,C130,Malignant neoplasm: Postcricoid region
72,C131,"Malignant neoplasm: Aryepiglottic fold, hypopharyngeal aspect"
73,C132,Malignant neoplasm: Posterior wall of hypopharynx
74,C138,Malignant neoplasm: Overlapping lesion of hypopharynx
75,C139,"Malignant neoplasm: Hypopharynx, unspecified"
76,C14X,"Malignant neoplasm of other and ill-defined sites in the lip, oral cavity and pharynx"
77,C140,"Malignant neoplasm: Pharynx, unspecified"
78,C142,Malignant neoplasm: Waldeyer ring
79,C148,"Malignant neoplasm: Overlapping lesion of lip, oral cavity and pharynx"
80,C15X,Malignant neoplasm of oesophagus
81,C15-C26,Malignant neoplasms of digestive organs
82,C150,Malignant neoplasm: Cervical part of oesophagus
83,C151,Malignant neoplasm: Thoracic part of oesophagus
84,C152,Malignant neoplasm: Abdominal part of oesophagus
85,C153,Malignant neoplasm: Upper third of oesophagus
86,C154,Malignant neoplasm: Middle third of oesophagus
87,C155,Malignant neoplasm: Lower third of oesophagus
88,C158,Malignant neoplasm: Overlapping lesion of oesophagus
89,C159,"Malignant neoplasm: Oesophagus, unspecified"
90,C16X,Malignant neoplasm of stomach
91,C160,Malignant neoplasm: Cardia
92,C161,Malignant neoplasm: Fundus of stomach
93,C162,Malignant neoplasm: Body of stomach
94,C163,Malignant neoplasm: Pyloric antrum
95,C164,Malignant neoplasm: Pylorus
96,C165,"Malignant neoplasm: Lesser curvature of stomach, unspecified"
97,C166,"Malignant neoplasm: Greater curvature of stomach, unspecified"
98,C168,Malignant neoplasm: Overlapping lesion of stomach
99,C169,"Malignant neoplasm: Stomach, unspecified"
100,C17X,Malignant neoplasm of small intestine
101,C170,Malignant neoplasm: Duodenum
102,C171,Malignant neoplasm: Jejunum
103,C172,Malignant neoplasm: Ileum
104,C173,Malignant neoplasm: Meckel diverticulum
105,C178,Malignant neoplasm: Overlapping lesion of small intestine
106,C179,"Malignant neoplasm: Small intestine, unspecified"
107,C18X,Malignant neoplasm of colon
108,C180,Malignant neoplasm: Caecum
109,C181,Malignant neoplasm: Appendix
110,C182,Malignant neoplasm: Ascending colon
111,C183,Malignant neoplasm: Hepatic flexure
112,C184,Malignant neoplasm: Transverse colon
113,C185,Malignant neoplasm: Splenic flexure
114,C186,Malignant neoplasm: Descending colon
115,C187,Malignant neoplasm: Sigmoid colon
116,C188,Malignant neoplasm: Overlapping lesion of colon
117,C189,"Malignant neoplasm: Colon, unspecified"
118,C19X,Malignant neoplasm of rectosigmoid junction
119,C20X,Malignant neoplasm of rectum
120,C21X,Malignant neoplasm of anus and anal canal
121,C210,"Malignant neoplasm: Anus, unspecified"
122,C211,Malignant neoplasm: Anal canal
123,C212,Malignant neoplasm: Cloacogenic zone
124,C218,"Malignant neoplasm: Overlapping lesion of rectum, anus and anal canal"
125,C22X,Malignant neoplasm of liver and intrahepatic bile ducts
126,C220,Malignant neoplasm: Liver cell carcinoma
127,C221,Malignant neoplasm: Intrahepatic bile duct carcinoma
128,C222,Malignant neoplasm: Hepatoblastoma
129,C223,Malignant neoplasm: Angiosarcoma of liver
130,C224,Malignant neoplasm: Other sarcomas of liver
131,C227,Malignant neoplasm: Other specified carcinomas of liver
132,C229,"Malignant neoplasm: Liver, unspecified"
133,C23X,Malignant neoplasm of gallbladder
134,C24X,Malignant neoplasm of other and unspecified parts of biliary tract
135,C240,Malignant neoplasm: Extrahepatic bile duct
136,C241,Malignant neoplasm: Ampulla of Vater
137,C248,Malignant neoplasm: Overlapping lesion of biliary tract
138,C249,"Malignant neoplasm: Biliary tract, unspecified"
139,C25X,Malignant neoplasm of pancreas
140,C250,Malignant neoplasm: Head of pancreas
141,C251,Malignant neoplasm: Body of pancreas
142,C252,Malignant neoplasm: Tail of pancreas
143,C253,Malignant neoplasm: Pancreatic duct
144,C254,Malignant neoplasm: Endocrine pancreas
145,C257,Malignant neoplasm: Other parts of pancreas
146,C258,Malignant neoplasm: Overlapping lesion of pancreas
147,C259,"Malignant neoplasm: Pancreas, unspecified"
148,C26X,Malignant neoplasm of other and ill-defined digestive organs
149,C260,"Malignant neoplasm: Intestinal tract, part unspecified"
150,C261,Malignant neoplasm: Spleen
151,C268,Malignant neoplasm: Overlapping lesion of digestive system
152,C269,Malignant neoplasm: Ill-defined sites within the digestive system
153,C30X,Malignant neoplasm of nasal cavity and middle ear
154,C30-C39,Malignant neoplasms of respiratory and intrathoracic organs
155,C300,Malignant neoplasm: Nasal cavity
156,C301,Malignant neoplasm: Middle ear
157,C31X,Malignant neoplasm of accessory sinuses
158,C310,Malignant neoplasm: Maxillary sinus
159,C311,Malignant neoplasm: Ethmoidal sinus
160,C312,Malignant neoplasm: Frontal sinus
161,C313,Malignant neoplasm: Sphenoidal sinus
162,C318,Malignant neoplasm: Overlapping lesion of accessory sinuses
163,C319,"Malignant neoplasm: Accessory sinus, unspecified"
164,C32X,Malignant neoplasm of larynx
165,C320,Malignant neoplasm: Glottis
166,C321,Malignant neoplasm: Supraglottis
167,C322,Malignant neoplasm: Subglottis
168,C323,Malignant neoplasm: Laryngeal cartilage
169,C328,Malignant neoplasm: Overlapping lesion of larynx
170,C329,"Malignant neoplasm: Larynx, unspecified"
171,C33X,Malignant neoplasm of trachea
172,C34X,Malignant neoplasm of bronchus and lung
173,C340,Malignant neoplasm: Main bronchus
174,C341,"Malignant neoplasm: Upper lobe, bronchus or lung"
175,C342,"Malignant neoplasm: Middle lobe, bronchus or lung"
176,C343,"Malignant neoplasm: Lower lobe, bronchus or lung"
177,C348,Malignant neoplasm: Overlapping lesion of bronchus and lung
178,C349,"Malignant neoplasm: Bronchus or lung, unspecified"
179,C37X,Malignant neoplasm of thymus
180,C38X,"Malignant neoplasm of heart, mediastinum and pleura"
181,C380,Malignant neoplasm: Heart
182,C381,Malignant neoplasm: Anterior mediastinum
183,C382,Malignant neoplasm: Posterior mediastinum
184,C383,"Malignant neoplasm: Mediastinum, part unspecified"
185,C384,Malignant neoplasm: Pleura
186,C388,"Malignant neoplasm: Overlapping lesion of heart, mediastinum and pleura"
187,C39X,Malignant neoplasm of other and ill-defined sites in the respiratory system and intrathoracic organs
188,C390,"Malignant neoplasm: Upper respiratory tract, part unspecified"
189,C398,Malignant neoplasm: Overlapping lesion of respiratory and intrathoracic organs
190,C399,Malignant neoplasm: Ill-defined sites within the respiratory system
191,C40X,Malignant neoplasm of bone and articular cartilage of limbs
192,C40-C41,Malignant neoplasms of bone and articular cartilage
193,C400,Malignant neoplasm: Scapula and long bones of upper limb
194,C401,Malignant neoplasm: Short bones of upper limb
195,C402,Malignant neoplasm: Long bones of lower limb
196,C403,Malignant neoplasm: Short bones of lower limb
197,C408,Malignant neoplasm: Overlapping lesion of bone and articular cartilage of limbs
198,C409,"Malignant neoplasm: Bone and articular cartilage of limb, unspecified"
199,C41X,Malignant neoplasm of bone and articular cartilage of other and unspecified sites
200,C410,Malignant neoplasm: Bones of skull and face
201,C411,Malignant neoplasm: Mandible
202,C412,Malignant neoplasm: Vertebral column
203,C413,"Malignant neoplasm: Ribs, sternum and clavicle"
204,C414,"Malignant neoplasm: Pelvic bones, sacrum and coccyx"
205,C418,Malignant neoplasm: Overlapping lesion of bone and articular cartilage
206,C419,"Malignant neoplasm: Bone and articular cartilage, unspecified"
207,C43X,Malignant melanoma of skin
208,C43-C44,Melanoma and other malignant neoplasms of skin
209,C430,Malignant neoplasm: Malignant melanoma of lip
210,C431,"Malignant neoplasm: Malignant melanoma of eyelid, including canthus"
211,C432,Malignant neoplasm: Malignant melanoma of ear and external auricular canal
212,C433,Malignant neoplasm: Malignant melanoma of other and unspecified parts of face
213,C434,Malignant neoplasm: Malignant melanoma of scalp and neck
214,C435,Malignant neoplasm: Malignant melanoma of trunk
215,C436,"Malignant neoplasm: Malignant melanoma of upper limb, including shoulder"
216,C437,"Malignant neoplasm: Malignant melanoma of lower limb, including hip"
217,C438,Malignant neoplasm: Overlapping malignant melanoma of skin
218,C439,"Malignant neoplasm: Malignant melanoma of skin, unspecified"
219,C44X,Other malignant neoplasms of skin
220,C440,Malignant neoplasm: Skin of lip
221,C441,"Malignant neoplasm: Skin of eyelid, including canthus"
222,C442,Malignant neoplasm: Skin of ear and external auricular canal
223,C443,Malignant neoplasm: Skin of other and unspecified parts of face
224,C444,Malignant neoplasm: Skin of scalp and neck
225,C445,Malignant neoplasm: Skin of trunk
226,C446,"Malignant neoplasm: Skin of upper limb, including shoulder"
227,C447,"Malignant neoplasm: Skin of lower limb, including hip"
228,C448,Malignant neoplasm: Overlapping lesion of skin
229,C449,"Malignant neoplasm: Malignant neoplasm of skin, unspecified"
230,C45X,Mesothelioma
231,C45-C49,Malignant neoplasms of mesothelial and soft tissue
232,C450,Mesothelioma of pleura
233,C451,Mesothelioma of peritoneum
234,C452,Mesothelioma of pericardium
235,C457,Mesothelioma of other sites
236,C459,"Mesothelioma, unspecified"
237,C46X,Kaposi sarcoma
238,C460,Kaposi sarcoma of skin
239,C461,Kaposi sarcoma of soft tissue
240,C462,Kaposi sarcoma of palate
241,C463,Kaposi sarcoma of lymph nodes
242,C467,Kaposi sarcoma of other sites
243,C468,Kaposi sarcoma of multiple organs
244,C469,"Kaposi sarcoma, unspecified"
245,C47X,Malignant neoplasm of peripheral nerves and autonomic nervous system
246,C470,"Malignant neoplasm: Peripheral nerves of head, face and neck"
247,C471,"Malignant neoplasm: Peripheral nerves of upper limb, including shoulder"
248,C472,"Malignant neoplasm: Peripheral nerves of lower limb, including hip"
249,C473,Malignant neoplasm: Peripheral nerves of thorax
250,C474,Malignant neoplasm: Peripheral nerves of abdomen
251,C475,Malignant neoplasm: Peripheral nerves of pelvis
252,C476,"Malignant neoplasm: Peripheral nerves of trunk, unspecified"
253,C478,Malignant neoplasm: Overlapping lesion of peripheral nerves and autonomic nervous system
254,C479,"Malignant neoplasm: Peripheral nerves and autonomic nervous system, unspecified"
255,C48X,Malignant neoplasm of retroperitoneum and peritoneum
256,C480,Malignant neoplasm: Retroperitoneum
257,C481,Malignant neoplasm: Specified parts of peritoneum
258,C482,"Malignant neoplasm: Peritoneum, unspecified"
259,C488,Malignant neoplasm: Overlapping lesion of retroperitoneum and peritoneum
260,C49X,Malignant neoplasm of other connective and soft tissue
261,C490,"Malignant neoplasm: Connective and soft tissue of head, face and neck"
262,C491,"Malignant neoplasm: Connective and soft tissue of upper limb, including shoulder"
263,C492,"Malignant neoplasm: Connective and soft tissue of lower limb, including hip"
264,C493,Malignant neoplasm: Connective and soft tissue of thorax
265,C494,Malignant neoplasm: Connective and soft tissue of abdomen
266,C495,Malignant neoplasm: Connective and soft tissue of pelvis
267,C496,"Malignant neoplasm: Connective and soft tissue of trunk, unspecified"
268,C498,Malignant neoplasm: Overlapping lesion of connective and soft tissue
269,C499,"Malignant neoplasm: Connective and soft tissue, unspecified"
270,C50X,Malignant neoplasm of breast
271,C50-C50,Malignant neoplasm of breast
272,C500,Malignant neoplasm: Nipple and areola
273,C501,Malignant neoplasm: Central portion of breast
274,C502,Malignant neoplasm: Upper-inner quadrant of breast
275,C503,Malignant neoplasm: Lower-inner quadrant of breast
276,C504,Malignant neoplasm: Upper-outer quadrant of breast
277,C505,Malignant neoplasm: Lower-outer quadrant of breast
278,C506,Malignant neoplasm: Axillary tail of breast
279,C508,Malignant neoplasm: Overlapping lesion of breast
280,C509,"Malignant neoplasm: Breast, unspecified"
281,C51X,Malignant neoplasm of vulva
282,C51-C58,Malignant neoplasms of female genital organs
283,C510,Malignant neoplasm: Labium majus
284,C511,Malignant neoplasm: Labium minus
285,C512,Malignant neoplasm: Clitoris
286,C518,Malignant neoplasm: Overlapping lesion of vulva
287,C519,"Malignant neoplasm: Vulva, unspecified"
288,C52X,Malignant neoplasm of vagina
289,C53X,Malignant neoplasm of cervix uteri
290,C530,Malignant neoplasm: Endocervix
291,C531,Malignant neoplasm: Exocervix
292,C538,Malignant neoplasm: Overlapping lesion of cervix uteri
293,C539,"Malignant neoplasm: Cervix uteri, unspecified"
294,C54X,Malignant neoplasm of corpus uteri
295,C540,Malignant neoplasm: Isthmus uteri
296,C541,Malignant neoplasm: Endometrium
297,C542,Malignant neoplasm: Myometrium
298,C543,Malignant neoplasm: Fundus uteri
299,C548,Malignant neoplasm: Overlapping lesion of corpus uteri
300,C549,"Malignant neoplasm: Corpus uteri, unspecified"
301,C55X,"Malignant neoplasm of uterus, part unspecified"
302,C56X,Malignant neoplasm of ovary
303,C57X,Malignant neoplasm of other and unspecified female genital organs
304,C570,Malignant neoplasm: Fallopian tube
305,C571,Malignant neoplasm: Broad ligament
306,C572,Malignant neoplasm: Round ligament
307,C573,Malignant neoplasm: Parametrium
308,C574,"Malignant neoplasm: Uterine adnexa, unspecified"
309,C577,Malignant neoplasm: Other specified female genital organs
310,C578,Malignant neoplasm: Overlapping lesion of female genital organs
311,C579,"Malignant neoplasm: Female genital organ, unspecified"
312,C58X,Malignant neoplasm of placenta
313,C60X,Malignant neoplasm of penis
314,C60-C63,Malignant neoplasms of male genital organs
315,C600,Malignant neoplasm: Prepuce
316,C601,Malignant neoplasm: Glans penis
317,C602,Malignant neoplasm: Body of penis
318,C608,Malignant neoplasm: Overlapping lesion of penis
319,C609,"Malignant neoplasm: Penis, unspecified"
320,C61X,Malignant neoplasm of prostate
321,C62X,Malignant neoplasm of testis
322,C620,Malignant neoplasm: Undescended testis
323,C621,Malignant neoplasm: Descended testis
324,C629,"Malignant neoplasm: Testis, unspecified"
325,C63X,Malignant neoplasm of other and unspecified male genital organs
326,C630,Malignant neoplasm: Epididymis
327,C631,Malignant neoplasm: Spermatic cord
328,C632,Malignant neoplasm: Scrotum
329,C637,Malignant neoplasm: Other specified male genital organs
330,C638,Malignant neoplasm: Overlapping lesion of male genital organs
331,C639,"Malignant neoplasm: Male genital organ, unspecified"
332,C64X,"Malignant neoplasm of kidney, except renal pelvis"
333,C64-C68,Malignant neoplasms of urinary tract
334,C65X,Malignant neoplasm of renal pelvis
335,C66X,Malignant neoplasm of ureter
336,C67X,Malignant neoplasm of bladder
337,C670,Malignant neoplasm: Trigone of bladder
338,C671,Malignant neoplasm: Dome of bladder
339,C672,Malignant neoplasm: Lateral wall of bladder
340,C673,Malignant neoplasm: Anterior wall of bladder
341,C674,Malignant neoplasm: Posterior wall of bladder
342,C675,Malignant neoplasm: Bladder neck
343,C676,Malignant neoplasm: Ureteric orifice
344,C677,Malignant neoplasm: Urachus
345,C678,Malignant neoplasm: Overlapping lesion of bladder
346,C679,"Malignant neoplasm: Bladder, unspecified"
347,C68X,Malignant neoplasm of other and unspecified urinary organs
348,C680,Malignant neoplasm: Urethra
349,C681,Malignant neoplasm: Paraurethral gland
350,C688,Malignant neoplasm: Overlapping lesion of urinary organs
351,C689,"Malignant neoplasm: Urinary organ, unspecified"
352,C69X,Malignant neoplasm of eye and adnexa
353,C69-C72,"Malignant neoplasms of eye, brain and other parts of central nervous system"
354,C690,Malignant neoplasm: Conjunctiva
355,C691,Malignant neoplasm: Cornea
356,C692,Malignant neoplasm: Retina
357,C693,Malignant neoplasm: Choroid
358,C694,Malignant neoplasm: Ciliary body
359,C695,Malignant neoplasm: Lacrimal gland and duct
360,C696,Malignant neoplasm: Orbit
361,C698,Malignant neoplasm: Overlapping lesion of eye and adnexa
362,C699,"Malignant neoplasm: Eye, unspecified"
363,C70X,Malignant neoplasm of meninges
364,C700,Malignant neoplasm: Cerebral meninges
365,C701,Malignant neoplasm: Spinal meninges
366,C709,"Malignant neoplasm: Meninges, unspecified"
367,C71X,Malignant neoplasm of brain
368,C710,"Malignant neoplasm: Cerebrum, except lobes and ventricles"
369,C711,Malignant neoplasm: Frontal lobe
370,C712,Malignant neoplasm: Temporal lobe
371,C713,Malignant neoplasm: Parietal lobe
372,C714,Malignant neoplasm: Occipital lobe
373,C715,Malignant neoplasm: Cerebral ventricle
374,C716,Malignant neoplasm: Cerebellum
375,C717,Malignant neoplasm: Brain stem
376,C718,Malignant neoplasm: Overlapping lesion of brain
377,C719,"Malignant neoplasm: Brain, unspecified"
378,C72X,"Malignant neoplasm of spinal cord, cranial nerves and other parts of central nervous system"
379,C720,Malignant neoplasm: Spinal cord
380,C721,Malignant neoplasm: Cauda equina
381,C722,Malignant neoplasm: Olfactory nerve
382,C723,Malignant neoplasm: Optic nerve
383,C724,Malignant neoplasm: Acoustic nerve
384,C725,Malignant neoplasm: Other and unspecified cranial nerves
385,C728,Malignant neoplasm: Overlapping lesion of brain and other parts of central nervous system
386,C729,"Malignant neoplasm: Central nervous system, unspecified"
387,C73X,Malignant neoplasm of thyroid gland
388,C73-C75,Malignant neoplasms of thyroid and other endocrine glands
389,C74X,Malignant neoplasm of adrenal gland
390,C740,Malignant neoplasm: Cortex of adrenal gland
391,C741,Malignant neoplasm: Medulla of adrenal gland
392,C749,"Malignant neoplasm: Adrenal gland, unspecified"
393,C75X,Malignant neoplasm of other endocrine glands and related structures
394,C750,Malignant neoplasm: Parathyroid gland
395,C751,Malignant neoplasm: Pituitary gland
396,C752,Malignant neoplasm: Craniopharyngeal duct
397,C753,Malignant neoplasm: Pineal gland
398,C754,Malignant neoplasm: Carotid body
399,C755,Malignant neoplasm: Aortic body and other paraganglia
400,C758,"Malignant neoplasm: Pluriglandular involvement, unspecified"
401,C759,"Malignant neoplasm: Endocrine gland, unspecified"
402,C76X,Malignant neoplasm of other and ill-defined sites
403,C76-C80,"Malignant neoplasms of ill-defined, secondary and unspecified sites"
404,C760,"Malignant neoplasm of other and ill-defined sites: Head, face and neck"
405,C761,Malignant neoplasm of other and ill-defined sites: Thorax
406,C762,Malignant neoplasm of other and ill-defined sites: Abdomen
407,C763,Malignant neoplasm of other and ill-defined sites: Pelvis
408,C764,Malignant neoplasm of other and ill-defined sites: Upper limb
409,C765,Malignant neoplasm of other and ill-defined sites: Lower limb
410,C767,Malignant neoplasm of other and ill-defined sites: Other ill-defined sites
411,C768,Malignant neoplasm of other and ill-defined sites: Overlapping lesion of other and ill-defined sites
412,C77X,Secondary and unspecified malignant neoplasm of lymph nodes
413,C770,"Secondary and unspecified malignant neoplasm: Lymph nodes of head, face and neck"
414,C771,Secondary and unspecified malignant neoplasm: Intrathoracic lymph nodes
415,C772,Secondary and unspecified malignant neoplasm: Intra-abdominal lymph nodes
416,C773,Secondary and unspecified malignant neoplasm: Axillary and upper limb lymph nodes
417,C774,Secondary and unspecified malignant neoplasm: Inguinal and lower limb lymph nodes
418,C775,Secondary and unspecified malignant neoplasm: Intrapelvic lymph nodes
419,C778,Secondary and unspecified malignant neoplasm: Lymph nodes of multiple regions
420,C779,"Secondary and unspecified malignant neoplasm: Lymph node, unspecified"
421,C78X,Secondary malignant neoplasm of respiratory and digestive organs
422,C780,Secondary malignant neoplasm of lung
423,C781,Secondary malignant neoplasm of mediastinum
424,C782,Secondary malignant neoplasm of pleura
425,C783,Secondary malignant neoplasm of other and unspecified respiratory organs
426,C784,Secondary malignant neoplasm of small intestine
427,C785,Secondary malignant neoplasm of large intestine and rectum
428,C786,Secondary malignant neoplasm of retroperitoneum and peritoneum
429,C787,Secondary malignant neoplasm of liver and intrahepatic bile duct
430,C788,Secondary malignant neoplasm of other and unspecified digestive organs
431,C79X,Secondary malignant neoplasm of other and unspecified sites
432,C790,Secondary malignant neoplasm of kidney and renal pelvis
433,C791,Secondary malignant neoplasm of bladder and other and unspecified urinary organs
434,C792,Secondary malignant neoplasm of skin
435,C793,Secondary malignant neoplasm of brain and cerebral meninges
436,C794,Secondary malignant neoplasm of other and unspecified parts of nervous system
437,C795,Secondary malignant neoplasm of bone and bone marrow
438,C796,Secondary malignant neoplasm of ovary
439,C797,Secondary malignant neoplasm of adrenal gland
440,C798,Secondary malignant neoplasm of other specified sites
441,C799,"Secondary malignant neoplasm, unspecified site"
442,C80X,"Malignant neoplasm, without specification of site"
443,C800,"Malignant neoplasm, primary site unknown, so stated"
444,C809,"Malignant neoplasm, primary site unspecified"
445,C81X,Hodgkin lymphoma
446,C81-C96,"Malignant neoplasms, stated or presumed to be primary, of lymphoid, haematopoietic and related tissue"
447,C810,Nodular lymphocyte predominant Hodgkin lymphoma
448,C811,Nodular sclerosis classical Hodgkin lymphoma
449,C812,Mixed cellularity classical Hodgkin lymphoma
450,C813,Lymphocyte depleted classical Hodgkin lymphoma
451,C814,Lymphocyte-rich (classical) Hodgkin lymphoma
452,C817,Other classical Hodgkin lymphoma
453,C819,"Hodgkin lymphoma, unspecified"
454,C82X,Follicular lymphoma
455,C820,Follicular lymphoma grade I
456,C821,Follicular lymphoma grade II
457,C822,"Follicular lymphoma grade III, unspecified"
458,C823,Follicular lymphoma grade IIIa
459,C824,Follicular lymphoma grade IIIb
460,C825,Diffuse follicle centre lymphoma
461,C826,Cutaneous follicle centre lymphoma
462,C827,Other types of follicular lymphoma
463,C829,"Follicular lymphoma, unspecified"
464,C83X,Non-follicular lymphoma
465,C830,Small cell B-cell lymphoma
466,C831,Mantle cell lymphoma
467,C833,Diffuse large B-cell lymphoma
468,C835,Lymphoblastic (diffuse) lymphoma
469,C837,Burkitt lymphoma
470,C838,Other non-follicular lymphoma
471,C839,"Non-follicular (diffuse) lymphoma, unspecified"
